name,age,gender,location,income,tenure,occupation,education,transport,political_leaning,trust,issues,engagement
Ryan,49,Non-binary,North Bondi,"$87,843",Owner (apartment),Tradie,Apprenticeship,Scooter,Greens,Low,"Urban density, Street safety, Heritage protection, Cycleways",Engages on Reddit
Robert,76,Non-binary,North Bondi,"$29,752",Mortgage holder,Hospitality worker,Bachelor’s degree,Bus + Walking,Teal Independent,Medium,"Climate resilience, Developer accountability, Housing affordability",Writes to council
William,64,Male,North Bondi,"$101,623",Homeowner,Tradie,High School,Walk,Teal Independent,Medium,"Rent pressure, Climate resilience, Noise control",Engages on Reddit
Kelly,65,Female,Bondi Junction,"$92,516",Student housing,Engineer,Apprenticeship,Train,Labor,High,"Heritage protection, Urban density",Engages on Reddit
Roger,80,Non-binary,Bondi Beach,"$118,745",Private renter,HR manager,Apprenticeship,Walk,Greens,Low,"Developer accountability, Traffic",Completes surveys
Ethan,23,Non-binary,Waverley,"$78,810",Mortgage holder,Accountant,Apprenticeship,Scooter,Socialist Alliance,High,"Climate resilience, Rent pressure",Active in neighbourhood committees
Sara,68,Non-binary,Bronte,"$44,264",Student housing,Software developer,Postgraduate degree,Ute,Socialist Alliance,Low,"Heritage protection, Traffic, Youth housing, Housing affordability",Posts in community Facebook groups
Mark,81,Male,Queens Park,"$84,307",Private renter,Delivery driver,High School,Walk,Greens,Low,"Developer accountability, Noise control, Street safety, Heritage protection",Engages on Reddit
Meghan,33,Male,Bondi Junction,"$71,631",Owner (apartment),Public servant,High School,Bus,Centre,Low-medium,"Traffic, Developer accountability",Writes to council
Chelsea,82,Male,Waverley,"$52,174",Student housing,Tradie,Bachelor’s degree,Bus + Walking,Greens,Medium,"Traffic, Urban density",Reads local planning updates
Steven,45,Female,Bronte,"$31,093",Student housing,Accountant,TAFE Certificate,Ute,Labor,Low,"Street safety, Climate resilience, Heritage protection, Youth housing",Active in neighbourhood committees
Patty,82,Male,Bondi Junction,"$115,074",Owner (apartment),Nurse,Postgraduate degree,Bike,Labor,Low-medium,"Developer accountability, Public space",Occasionally signs petitions
Susan,66,Female,Tamarama,"$112,541",Private renter,Teacher,Postgraduate degree,Car,Labor,Low,"Cycleways, Youth housing",Occasionally signs petitions
Christina,63,Male,Bondi Junction,"$64,199",Student housing,Nurse,Bachelor’s degree,Car + Train,Centre,Low-medium,"Youth housing, Noise control",Attends community forums
Elizabeth,64,Non-binary,Bondi Junction,"$42,190",Student housing,Accountant,TAFE Certificate,Bus,Teal Independent,Low,"Rent pressure, Noise control, Urban density, Heritage protection",Engages on Reddit
James,58,Non-binary,Dover Heights,"$123,358",Renter in sharehouse,Teacher,TAFE Certificate,Bus,Greens,Medium-high,"Public space, Climate resilience",Occasionally signs petitions
Leah,19,Male,Tamarama,"$53,154",Owner (apartment),Designer,TAFE Certificate,Car,Labor,High,"Cycleways, Traffic, Youth housing, Street safety",Reads local planning updates
Juan,38,Female,Dover Heights,"$141,251",Mortgage holder,Artist,No formal qualification,Walk,Socialist Alliance,Medium,"Public space, Noise control, Urban density",Posts in community Facebook groups
Kathleen,50,Non-binary,Dover Heights,"$108,503",Student housing,Retail assistant,Bachelor’s degree,Walk,Labor,Low,"Youth housing, Housing affordability, Public space, Rent pressure",Posts in community Facebook groups
Mitchell,55,Male,Queens Park,"$20,929",Student housing,Designer,Bachelor’s degree,Scooter,Labor,High,"Noise control, Housing affordability",Attends community forums
Christian,81,Non-binary,Bronte,"$46,417",Owner (apartment),Engineer,Postgraduate degree,Walk,Socialist Alliance,Medium,"Rent pressure, Youth housing",Occasionally signs petitions
Andrew,76,Non-binary,Bondi Beach,"$120,240",Renter in sharehouse,Tradie,Bachelor’s degree,Walk,Centre,Low,"Heritage protection, Rent pressure",Writes to council
William,63,Non-binary,North Bondi,"$94,027",Mortgage holder,Student,Bachelor’s degree,Train,Labor,High,"Noise control, Climate resilience, Heritage protection, Rent pressure",Attends community forums
Peter,41,Female,Bronte,"$97,988",Owner (duplex),Retail assistant,Bachelor’s degree,Walk,Labor,Low-medium,"Youth housing, Climate resilience, Housing affordability",Completes surveys
Nathan,22,Male,Queens Park,"$66,099",Private renter,Delivery driver,TAFE Certificate,Scooter,Labor,Medium-high,"Rent pressure, Public space, Youth housing, Housing affordability",Engages on Reddit
Christopher,32,Non-binary,Randwick,"$124,946",Homeowner,Hospitality worker,High School,Walk,Socialist Alliance,Medium-high,"Traffic, Rent pressure, Youth housing",Posts in community Facebook groups
Mary,89,Non-binary,Tamarama,"$41,826",Mortgage holder,Retail assistant,Postgraduate degree,Ute,Liberal,Low-medium,"Rent pressure, Heritage protection, Developer accountability",Attends community forums
Kevin,74,Female,Bronte,"$97,842",Homeowner,Designer,TAFE Certificate,Car,Socialist Alliance,Medium-high,"Traffic, Street safety",Posts in community Facebook groups
Sheila,53,Non-binary,Dover Heights,"$35,038",Owner (duplex),Teacher,TAFE Certificate,Bike,Socialist Alliance,Medium-high,"Public space, Cycleways, Climate resilience, Developer accountability",Reads local planning updates
Emily,33,Female,Dover Heights,"$131,041",Homeowner,Artist,Bachelor’s degree,Bus,Greens,Medium-high,"Traffic, Street safety, Cycleways",Occasionally signs petitions
Brittney,36,Male,Randwick,"$133,365",Owner (duplex),Hospitality worker,Apprenticeship,Bike,Socialist Alliance,High,"Developer accountability, Heritage protection, Street safety",Active in neighbourhood committees
Keith,29,Non-binary,Dover Heights,"$57,713",Homeowner,HR manager,High School,Bus + Walking,Teal Independent,Low,"Public space, Cycleways, Developer accountability, Street safety",Posts in community Facebook groups
Clayton,23,Male,Randwick,"$75,103",Renter in sharehouse,Public servant,High School,Bus + Walking,Labor,Medium-high,"Youth housing, Climate resilience, Housing affordability, Noise control",Active in neighbourhood committees
Richard,73,Non-binary,North Bondi,"$128,944",Homeowner,Student,TAFE Certificate,Car,Teal Independent,Medium-high,"Noise control, Traffic",Reads local planning updates
Steven,28,Male,Bondi Beach,"$131,022",Private renter,Delivery driver,No formal qualification,Walk,Teal Independent,Medium-high,"Youth housing, Traffic, Climate resilience, Street safety",Writes to council
Jason,88,Male,Dover Heights,"$47,364",Renter in sharehouse,Software developer,TAFE Certificate,Bus + Walking,Labor,Medium-high,"Street safety, Rent pressure, Heritage protection",Active in neighbourhood committees
Matthew,24,Female,Bronte,"$82,491",Owner (apartment),Public servant,Bachelor’s degree,Walk,Teal Independent,Low,"Public space, Cycleways",Writes to council
Amy,63,Male,North Bondi,"$137,861",Homeowner,Tradie,No formal qualification,Bike,Socialist Alliance,Medium,"Climate resilience, Traffic, Developer accountability, Urban density",Writes to council
Jennifer,77,Female,Tamarama,"$64,864",Student housing,Student,Bachelor’s degree,Car,Teal Independent,Medium,"Youth housing, Street safety, Cycleways, Housing affordability",Writes to council
Mario,24,Male,North Bondi,"$40,963",Renter in sharehouse,Student,Bachelor’s degree,Train,Labor,Medium-high,"Traffic, Housing affordability",Posts in community Facebook groups
Jennifer,46,Female,Dover Heights,"$51,131",Renter in sharehouse,HR manager,Bachelor’s degree,Ute,Teal Independent,Medium,"Heritage protection, Housing affordability, Noise control",Posts in community Facebook groups
Matthew,76,Female,Waverley,"$128,905",Private renter,Consultant,No formal qualification,Train,Greens,Low-medium,"Traffic, Public space",Posts in community Facebook groups
Amy,63,Female,Bondi Junction,"$36,241",Renter in sharehouse,Software developer,Bachelor’s degree,Bus + Walking,Greens,Low,"Housing affordability, Street safety, Cycleways",Occasionally signs petitions
Maria,20,Female,Tamarama,"$86,652",Student housing,Artist,High School,Car,Labor,Medium-high,"Housing affordability, Developer accountability",Attends community forums
Carolyn,28,Male,Randwick,"$83,761",Mortgage holder,Student,Apprenticeship,Scooter,Liberal,Medium,"Rent pressure, Developer accountability, Climate resilience",Occasionally signs petitions
Deborah,25,Female,Bondi Beach,"$131,086",Owner (apartment),Hospitality worker,High School,Ute,Labor,Medium-high,"Street safety, Housing affordability, Youth housing",Completes surveys
Jerry,59,Female,Waverley,"$63,463",Mortgage holder,Tradie,Postgraduate degree,Bus + Walking,Centre,Medium-high,"Urban density, Public space",Posts in community Facebook groups
Maria,88,Male,Bronte,"$29,171",Student housing,Retail assistant,Apprenticeship,Train,Greens,Low,"Noise control, Rent pressure, Street safety, Developer accountability",Reads local planning updates
Meredith,82,Female,Bondi Junction,"$35,417",Homeowner,Artist,Bachelor’s degree,Bike,Liberal,Medium-high,"Street safety, Climate resilience, Cycleways, Youth housing",Occasionally signs petitions
Heather,28,Non-binary,North Bondi,"$42,626",Student housing,Consultant,High School,Train,Centre,High,"Housing affordability, Urban density, Traffic, Street safety",Engages on Reddit
Steve,25,Male,Bronte,"$114,319",Owner (duplex),Delivery driver,Bachelor’s degree,Bus + Walking,Greens,High,"Youth housing, Noise control, Heritage protection",Active in neighbourhood committees
Courtney,21,Non-binary,Dover Heights,"$142,808",Private renter,Student,Postgraduate degree,Car + Train,Teal Independent,Low-medium,"Youth housing, Street safety",Engages on Reddit
Natasha,55,Male,Bondi Beach,"$58,402",Mortgage holder,Tradie,Bachelor’s degree,Scooter,Greens,High,"Developer accountability, Heritage protection, Street safety, Cycleways",Attends community forums
Lauren,74,Female,Tamarama,"$105,731",Owner (duplex),Designer,Apprenticeship,Walk,Socialist Alliance,Low-medium,"Public space, Cycleways",Posts in community Facebook groups
Shane,34,Non-binary,Randwick,"$140,442",Renter in sharehouse,Retail assistant,Apprenticeship,Car,Labor,Low,"Public space, Heritage protection, Developer accountability, Noise control",Engages on Reddit
Jacob,74,Male,Dover Heights,"$33,050",Private renter,Artist,No formal qualification,Scooter,Socialist Alliance,High,"Noise control, Cycleways",Active in neighbourhood committees
Claire,85,Female,Bondi Junction,"$90,482",Mortgage holder,Software developer,High School,Car + Train,Socialist Alliance,Medium,"Noise control, Developer accountability",Completes surveys
Matthew,82,Male,Tamarama,"$119,303",Renter in sharehouse,Delivery driver,High School,Train,Teal Independent,Medium-high,"Public space, Noise control, Youth housing, Housing affordability",Engages on Reddit
Sean,73,Non-binary,Bronte,"$31,889",Owner (duplex),Nurse,High School,Bus,Teal Independent,High,"Street safety, Youth housing",Attends community forums
Diana,76,Male,Dover Heights,"$138,639",Private renter,Nurse,Apprenticeship,Walk,Greens,Medium,"Public space, Heritage protection, Traffic",Active in neighbourhood committees
Desiree,37,Male,Queens Park,"$75,633",Owner (duplex),Consultant,No formal qualification,Bus + Walking,Liberal,Low-medium,"Climate resilience, Street safety, Youth housing",Posts in community Facebook groups
David,66,Non-binary,Bondi Junction,"$146,155",Owner (duplex),Engineer,High School,Bus,Labor,Medium-high,"Cycleways, Climate resilience, Public space",Reads local planning updates
James,58,Female,Bondi Beach,"$84,619",Mortgage holder,Software developer,High School,Bus,Socialist Alliance,Low-medium,"Climate resilience, Traffic, Public space",Writes to council
